{
  "$schema": "http://json-schema.org/draft-07/schema#",
  "$id": "https://raw.githubusercontent.com/mjmorales/claude-prove/main/schemas/prove.schema.json",
  "$comment": "Generated from PROVE_SCHEMA (packages/cli/src/topics/schema/schemas.ts) by scripts/generate-json-schema.ts — do not edit by hand.",
  "title": ".claude/.prove.json",
  "description": "claude-prove project configuration (schema v14)",
  "type": "object",
  "properties": {
    "$schema": {
      "type": "string",
      "description": "JSON Schema reference for editor autocomplete (ignored by claude-prove)"
    },
    "schema_version": {
      "type": "string",
      "description": "Schema version for migration tracking",
      "default": "14"
    },
    "dev_mode": {
      "type": "boolean",
      "description": "Run prove from the working-tree source instead of the installed `claude-prove` binary. When true, user-facing codegen (CLAUDE.md, agent prompts, hook templates) emits `bun run <pluginDir>/packages/cli/bin/run.ts <topic>`; when false (default), emits bare `claude-prove <topic>`. Set by plugin developers working from a git checkout.",
      "default": false
    },
    "scopes": {
      "type": "object",
      "additionalProperties": {
        "type": "string"
      },
      "description": "Maps commit scope names to directory paths"
    },
    "validators": {
      "type": "array",
      "items": {
        "type": "object",
        "properties": {
          "name": {
            "type": "string",
            "description": "Human-readable validator name"
          },
          "command": {
            "type": "string",
            "description": "Shell command to execute"
          },
          "prompt": {
            "type": "string",
            "description": "Path to LLM validation prompt file"
          },
          "skill": {
            "type": "string",
            "description": "Skill to invoke as the gate (e.g. \"claude-skills:comment-audit\"); the driver runs it via the Skill tool. Mutually exclusive with command/prompt"
          },
          "phase": {
            "type": "string",
            "enum": [
              "build",
              "lint",
              "test",
              "custom",
              "llm"
            ],
            "description": "Execution phase: build, lint, test, custom, or llm"
          }
        },
        "required": [
          "name",
          "phase"
        ],
        "additionalProperties": false
      },
      "description": "Ordered list of validation checks"
    },
    "reporters": {
      "type": "array",
      "items": {
        "type": "object",
        "properties": {
          "name": {
            "type": "string",
            "description": "Human-readable reporter name"
          },
          "command": {
            "type": "string",
            "description": "Shell command to execute"
          },
          "events": {
            "type": "array",
            "items": {
              "type": "string"
            },
            "description": "Event types that trigger this reporter"
          }
        },
        "required": [
          "name",
          "command",
          "events"
        ],
        "additionalProperties": false
      },
      "description": "Notification reporters for orchestrator events"
    },
    "claude_md": {
      "type": "object",
      "properties": {
        "references": {
          "type": "array",
          "items": {
            "type": "object",
            "properties": {
              "path": {
                "type": "string",
                "description": "File path for @ inclusion (supports ~ expansion)"
              },
              "label": {
                "type": "string",
                "description": "Human-readable label for this reference"
              }
            },
            "required": [
              "path",
              "label"
            ],
            "additionalProperties": false
          },
          "description": "External files to include in CLAUDE.md via @ references",
          "default": []
        }
      },
      "additionalProperties": false,
      "description": "CLAUDE.md generation settings"
    },
    "tools": {
      "type": "object",
      "additionalProperties": {
        "type": "object",
        "properties": {
          "enabled": {
            "type": "boolean",
            "description": "Whether this tool is active in the project",
            "default": true
          },
          "scope": {
            "type": "string",
            "description": "Activation scope (user or project)"
          },
          "config": {
            "type": "object",
            "description": "Tool-specific configuration overrides"
          }
        },
        "required": [
          "enabled"
        ],
        "additionalProperties": false
      },
      "description": "Tool activation state and configuration overrides. Known entries: acb, cafi, pcd, run_state, scrum (see TOOL_SCRUM_SCHEMA). Each entry has { enabled: bool, scope?: 'user' | 'project', config?: object }. The config object is free-form per tool. For acb, the supported config keys are base_branch and review_ui_port. The review UI image/tag are pinned by the tooling, never the project config."
    },
    "brief": {
      "type": "object",
      "properties": {
        "single_pass_token_threshold": {
          "type": "integer",
          "description": "Token budget that splits single-pass from multipass brief synthesis. Episodes whose combined token count is at or below this threshold synthesize in one pass; above it, the episodes are chunked and synthesized across multiple passes.",
          "default": 8000
        },
        "max_synthesis_retries": {
          "type": "integer",
          "description": "Retry budget for the Stage-2 brief synthesis step. On a failed synthesis attempt the step retries up to this many times before giving up.",
          "default": 2
        },
        "prose_judge_on": {
          "type": "boolean",
          "description": "Whether the non-blocking Stage-2 prose judge runs. When true, the judge scores synthesized prose for quality without gating the pipeline; when false, the judge is skipped entirely.",
          "default": true
        }
      },
      "additionalProperties": false,
      "description": "Agent Change Brief synthesis settings"
    },
    "memory": {
      "type": "object",
      "properties": {
        "stale_threshold_days": {
          "type": "integer",
          "description": "Age in days past which a decision record is reported stale by the decision review-stale report. Report-only — staleness never prunes or supersedes a decision.",
          "default": 90
        }
      },
      "additionalProperties": false,
      "description": "Durable-memory and decision-record settings"
    },
    "decomposition": {
      "type": "object",
      "properties": {
        "auto_accept_through": {
          "type": "string",
          "enum": [
            "none",
            "epic",
            "story",
            "task"
          ],
          "description": "Decompose layer through which children are auto-promoted backlog->ready without a human accept gate. Layers order epic -> story -> task; every layer at or above the named one auto-accepts and the gate still fires below it. 'none' is the off setting: the accept gate fires at every layer.",
          "default": "none"
        }
      },
      "additionalProperties": false,
      "description": "Decompose-ladder settings"
    },
    "artifacts": {
      "type": "object",
      "properties": {
        "html_open": {
          "type": "string",
          "description": "Shell command template used by `--open` (on `report` and `intake render`) to open a written HTML artifact. A `{file}` placeholder is replaced with the quoted artifact path; a template without the placeholder gets the path appended. Examples: 'cursor {file}' (editor embedded preview), 'open -a Safari {file}', 'xdg-open {file}'. Empty/absent = the platform default opener (macOS open, Windows start, else xdg-open).",
          "default": ""
        }
      },
      "additionalProperties": false,
      "description": "Rendered-artifact handling (HTML opener preferences)"
    },
    "triggers": {
      "type": "array",
      "items": {
        "type": "object",
        "properties": {
          "on": {
            "type": "string",
            "enum": [
              "backlog",
              "proposed",
              "accepted",
              "ready",
              "in_progress",
              "review",
              "blocked",
              "done",
              "cancelled"
            ],
            "description": "Task status whose entry fires this binding (the status-transition target — e.g. \"accepted\" fires the next-layer decompose)"
          },
          "workflow": {
            "type": "string",
            "description": "Bound next-action the reconciler surfaces when a task enters `on` (a workflow name or a short next-action label)"
          },
          "description": {
            "type": "string",
            "description": "Human-readable note on what this binding is for",
            "default": ""
          }
        },
        "required": [
          "on",
          "workflow"
        ],
        "additionalProperties": false
      },
      "description": "Declared trigger bindings: status-transition -> bound next-action. The scrum reconciler consults this table on session transitions (session-start / subagent-stop / stop) and surfaces the bound action via the session-start digest and next-ready. No resident evaluator — bindings fire only when a session reconciles; intra-run, a workflow script branches directly."
    },
    "cloud": {
      "type": "object",
      "properties": {
        "enabled": {
          "type": "boolean",
          "description": "Master switch for the optional cloud-sync layer. When absent or false (the default), prove is local-only and performs ZERO network I/O — every sync code path is dead. Flip to true (after running `store provision` to mint a machine-local db token) to opt this project into session-boundary push/pull against the cloud primary.",
          "default": false
        },
        "org": {
          "type": "string",
          "description": "Turso organization slug that owns the cloud database. Non-secret (committed) — the admin Platform API token and the db-scoped sync token are never stored here. Read only when cloud.enabled is true.",
          "default": ""
        },
        "group": {
          "type": "string",
          "description": "Turso group the database lives in (the provisioning group, e.g. \"prove\"). Non-secret. Read only when cloud.enabled is true.",
          "default": "prove"
        },
        "db_name": {
          "type": "string",
          "description": "Cloud database name for this project (e.g. \"prove-<slug>\"). Non-secret. Used as the machine-config key under which the db-scoped sync token is stored in ~/.claude-prove/config.json. Read only when cloud.enabled is true.",
          "default": ""
        }
      },
      "additionalProperties": false,
      "description": "Optional cloud-sync opt-in (added in schema v12). Non-secret config only — the org Platform API token (admin bootstrap secret) and the per-machine db-scoped sync token live OUTSIDE this file: the Platform token in the environment, the db token in the gitignored machine config ~/.claude-prove/config.json. Absent or { enabled: false } (the default) keeps prove local-only with zero network I/O."
    },
    "models": {
      "type": "object",
      "properties": {
        "main": {
          "type": "string",
          "description": "Recommended main-model selection for Claude Code sessions in this project: a model alias or full model ID. The headline value is 'opusplan' — Opus during plan mode, Sonnet for execution ('opusplan[1m]' forces the 1M context window in both phases). Plain aliases ('opus', 'sonnet', 'haiku') and full IDs (e.g. 'claude-opus-5') are also valid. Materialized into the gitignored .claude/settings.local.json `model` key — Claude Code treats it as an initial selection, never enforcement.",
          "default": ""
        },
        "advisor": {
          "type": "string",
          "description": "Recommended advisor model (a model alias or full model ID): a second, at-least-as-capable model Claude consults at decision points mid-task, which reads the full transcript and returns guidance. Materialized into the gitignored .claude/settings.local.json `advisorModel` key. The advisor tool is experimental, runs server-side on the Anthropic API only (unavailable on Bedrock/Vertex/Foundry) and bills at the advisor model’s rates; Claude Code silently detaches an advisor less capable than the main model.",
          "default": ""
        },
        "fallback": {
          "type": "array",
          "items": {
            "type": "string"
          },
          "description": "Recommended fallback-model chain (model aliases or full IDs) tried in order when the primary model returns a non-retryable server error. Materialized into the gitignored .claude/settings.local.json `fallbackModel` key; Claude Code caps chains at three models after duplicate removal.",
          "default": []
        },
        "effort": {
          "type": "string",
          "enum": [
            "low",
            "medium",
            "high",
            "xhigh",
            "max"
          ],
          "description": "Recommended effort level for sessions in this project. Materialized into the gitignored .claude/settings.local.json `env` block as CLAUDE_CODE_EFFORT_LEVEL. Claude Code clamps a level the active model does not support down to the highest supported level."
        },
        "planning": {
          "type": "string",
          "enum": [
            "prove",
            "native",
            "auto"
          ],
          "description": "How skills with a planning phase route that phase. `native` runs it inside Claude Code plan mode (an `opusplan` main gets its plan-mode Opus upgrade there; the plan-approval gate is Claude Code's own); `prove` keeps the prove-specific planning flow; `auto` (the absent-field default) resolves to native when the declared `main` is an opusplan alias and prove otherwise. Prove-side routing only — never materialized into Claude Code settings; `claude-prove models routing` prints the resolved mode."
        }
      },
      "additionalProperties": false,
      "description": "Recommended Claude Code model configuration for this project (added in schema v13). Declarative intent only: the committed block never changes behavior by itself — an operator materializes it into the gitignored .claude/settings.local.json via `claude-prove models apply`, because model choice is per-operator and billing-dependent. Absent block = no recommendation."
    }
  },
  "required": [
    "schema_version"
  ],
  "additionalProperties": false
}
